Passage Title,Question ID,Sentence Context,Option A,Option B,Option C,Option D,Option E,Correct Answer
Jungle Expedition,10,"A pair of yellow eyes glowed in the shadows, watching them with a predatory (10).","intense","intensity","intensify","intensely","intensive",B
Jungle Expedition,11,"""Back away, slowly,"" ordered Sterling, reaching for the flare gun at his (11).","belt","belts","belted","belting","belter",A
Jungle Expedition,12,"They realised that the temple was not abandoned; it was still being (12) by the descendants of the jaguar.","guard","guarded","guarding","guards","guardian",B
The Final Exam,1,"The exam hall was silent, save for the scratching of pens and the ticking of the clock that seemed to echo (1).","loud","loudly","loudness","louder","loudest",B
The Final Exam,2,"Rows of students sat with their heads bowed, their faces etched with concentration and (2).","worry","worried","worrying","worries","worrier",A
The Final Exam,3,"James stared at the paper in front of him, the words swimming before his eyes like fish in a (3).","bowl","bowled","bowling","bowls","bowler",A
The Final Exam,4,"He had revised for weeks, yet his mind had gone completely (4) at the worst possible moment.","blank","blanked","blanking","blanks","blankly",A
The Final Exam,5,"He took a deep breath, trying to calm the panic that was rising in his chest like a (5) tide.","rise","rose","risen","rising","rises",D
The Final Exam,6,"Glancing at the clock, he realised that half the time had already (6), and he had barely started.","pass","passed","past","passing","passes",B
The Final Exam,7,"Forcing himself to focus, he re-read the first question, and slowly, a flicker of understanding began to (7).","dawn","dawned","dawning","dawns","down",A
The Final Exam,8,"He picked up his pen and began to write, the ink flowing onto the page as his memory finally (8).","unlock","unlocked","unlocking","unlocks","locker",B
The Final Exam,9,"Point by point, he constructed his argument, citing facts and figures he thought he had (9).","forget","forgot","forgotten","forgetting","forgets",C
The Final Exam,10,"The scratching of his pen became faster, a race against time to get all his ideas (10) on paper.","down","up","in","on","out",A
The Final Exam,11,"""Five minutes remaining,"" announced the invigilator, her voice cutting through the silence like a (11).","knife","knives","knifed","knifing","knifer",A
The Final Exam,12,"James scribbled the final sentence, put down his pen, and slumped back in his chair, exhausted but (12).","relief","relieved","relieving","relieves","relieve",B
The Medieval Siege,1,"From the battlements, the archers watched as the enemy army swarmed across the plain like a plague of (1).","locust","locusts","locusting","locus","local",B
The Medieval Siege,2,"The sound of war drums thundered in the distance, a terrifying rhythm designed to strike (2) into the hearts of the defenders.","fear","feared","fearing","fears","fearful",A
The Medieval Siege,3,"Below, the drawbridge was raised and the portcullis lowered, sealing the castle against the impending (3).","assault","assaulted","assaulting","assaults","assaulter",A
The Medieval Siege,4,"Giant catapults, constructed from timber and iron, hurled massive boulders that crashed against the castle (4).","wall","walls","walled","walling","wallet",B
The Medieval Siege,5,"Inside the keep, the women and children huddled together, praying for (5) from the violence outside.","deliver","delivery","deliverance","delivered","delivers",C
The Medieval Siege,6,"Sir William, the castle commander, walked the ramparts, shouting orders to his men to hold their (6).","ground","grounded","grounding","grounds","grind",A
The Medieval Siege,7,"""Aim for the siege towers!"" he bellowed, pointing to the wooden structures inching towards the (7).","gate","gates","gated","gating","gait",A
The Medieval Siege,8,"Flaming arrows rained down from the sky, setting the wooden hoardings (8) and filling the air with smoke.","light","alight","lighting","lighted","lights",B
The Medieval Siege,9,"Soldiers poured boiling oil onto the attackers who tried to scale the ladders, forcing them to (9).","retreat","retreated","retreating","retreats","retreater",A
The Medieval Siege,10,"The battle raged for hours, a chaotic swirl of metal, fire, and screams of (10).","pain","pained","paining","pains","painful",A
The Medieval Siege,11,"As night fell, the enemy finally withdrew to their camp, leaving the castle battered but still (11).","stand","stood","standing","stands","standard",C
The Medieval Siege,12,"They knew the siege was far from over, but for tonight, they had (12).","survive","survived","surviving","survives","survival",B
Deep Sea Diving,1,"Descending into the blue abyss, the diver watched as the sunlight above faded to a faint (1).","glow","glowed","glowing","glows","glower",A
Deep Sea Diving,2,"The only sound was the rhythmic hiss of his regulator and the bubbling of his own (2).","breath","breathe","breathing","breathless","breaths",B
Deep Sea Diving,3,"Around him, a coral reef exploded with colour, teeming with fish that darted like living (3).","jewel","jewels","jewelled","jeweller","jewellery",B
Deep Sea Diving,4,"He checked his pressure gauge; he had thirty minutes of air left to explore this underwater (4).","wonder","wondered","wondering","wonderland","wonderful",D
Deep Sea Diving,5,"A sea turtle, ancient and graceful, glided past him, its shell covered in barnacles and (5).","algae","algal","alga","algaes","allergic",A
Deep Sea Diving,6,"He swam deeper, towards a shipwreck that lay on the ocean floor, its mast pointing upwards like a skeletal (6).","fingers","finger","fingered","fingering","fin",B
Deep Sea Diving,7,"Entering the cargo hold, he had to be careful not to disturb the silt that would cloud his (7).","vision","visible","visibility","visibly","visionary",A
Deep Sea Diving,8,"Suddenly, a moray eel lunged from a pipe, its jaws snapping (8) inches from his mask.","danger","dangerous","dangerously","endanger","dangers",C
Deep Sea Diving,9,"He recoiled in shock, his heart racing, and kicked his fins to put some (9) between them.","distant","distance","distantly","distances","distanced",B
Deep Sea Diving,10,"Checking his air again, he saw the needle was dropping; it was time to begin his (10) to the surface.","ascend","ascent","ascending","ascends","ascension",B
Deep Sea Diving,11,"He had to rise slowly to avoid the bends, stopping at intervals to let his body (11) to the pressure change.","adjust","adjusted","adjusting","adjusts","adjustment",A
Deep Sea Diving,12,"Breaking the surface, he took a deep breath of fresh air, grateful to be back in the world of the (12).","live","lived","living","life","alive",C
The Marathon,1,"At mile twenty, the runners hit what is known as 'the wall', a point where energy stores are depleted and exhaustion sets (1).","on","in","at","up","out",B
The Marathon,2,"Mark's legs felt like lead weights, and every step sent a jolt of (2) through his tired muscles.","pain","pained","paining","pains","painful",A
The Marathon,3,"He focused on the back of the runner ahead of him, using it as a target to keep himself (3).","move","moved","moving","moves","movement",C
The Marathon,4,"The crowds lining the streets shouted encouragement, their cheers a dull roar in his ringing (4).","ear","ears","eared","earing","hear",B
The Marathon,5,"He grabbed a cup of water from a volunteer, splashing it over his head to cool his (5) skin.","burn","burned","burning","burns","burner",C
The Marathon,6,"""You can do this,"" he muttered to himself, a mantra to drown out the voice in his head telling him to (6).","stop","stopped","stopping","stops","stopper",A
The Marathon,7,"Rounding the final corner, the finish line appeared in the distance, a banner of blue and yellow (7) in the wind.","flutter","fluttered","fluttering","flutters","fluttery",C
The Marathon,8,"A surge of adrenaline, summoned from reserves he didn't know he had, (8) him forward.","propel","propelled","propelling","propels","propeller",B
The Marathon,9,"He picked up his pace, ignoring the protests of his body, driven only by the desire to (9).","finish","finished","finishing","finishes","finisher",A
The Marathon,10,"Crossing the line, he collapsed onto the grass, his chest heaving as he gasped for (10).","air","airy","aired","airing","heir",A
The Marathon,11,"A volunteer placed a medal around his neck, the metal cool and heavy against his skin, a symbol of his (11).","achieve","achievement","achieved","achieving","achiever",B
The Marathon,12,"He had run twenty-six miles, a test of endurance that proved he was stronger than he had ever (12).","imagine","imagined","imagining","imagines","imagination",B
The Lost City of Gold,1,"The map, crumbling and yellowed with age, depicted a route through the mountains that no one had taken for (1).","century","centuries","centuried","centurion","cents",B
The Lost City of Gold,2,"They climbed higher into the thin air, where snow capped the peaks and the wind howled a lonely (2).","song","sang","sing","sung","singer",A
The Lost City of Gold,3,"One night, huddled around the campfire, the guide told them legends of the city, claiming the streets were paved with (3).","gold","golden","gilded","golds","golder",A
The Lost City of Gold,4,"Greed flickered in the eyes of the men, casting long shadows over their faces in the (4) firelight.","dance","danced","dancing","dances","dancer",C
The Lost City of Gold,5,"The next day, they reached a pass that looked down into a hidden valley, shrouded in (5).","mist","misty","misted","misting","mists",A
The Lost City of Gold,6,"As the sun burned away the fog, the ruins of a magnificent city were (6) below.","reveal","revealed","revealing","reveals","revelation",B
The Lost City of Gold,7,"Temples topped with gold spires glinted in the light, blinding them with their (7).","brilliant","brilliance","brilliantly","brills","brill",B
The Lost City of Gold,8,"They rushed down the slope, shouting and cheering, forgetting all caution in their haste to reach the (8).","treasure","treasured","treasuring","treasures","treasurer",A
The Lost City of Gold,9,"However, as they entered the city gates, they found the streets empty and silent as the (9).","grave","gravel","gravity","graves","graved",A
The Lost City of Gold,10,"It was a ghost city, abandoned centuries ago, leaving behind only echoes of its former (10).","glory","glorious","gloriously","glories","glorified",A
The Lost City of Gold,11,"They filled their bags with gold, but soon realised that gold cannot be eaten or drunk, and they were days from (11).","civil","civilise","civilisation","civility","civilian",C
The Lost City of Gold,12,"The true value of the city was not its wealth, but the warning it offered about the folly of human (12).","ambition","ambitious","ambitiously","ambitions","amble",A
A Winter's Tale,1,"The snow had been falling for three days straight, burying the village under a blanket of white that muffled every (1).","sound","sounded","sounding","sounds","soundly",A
A Winter's Tale,2,"Inside the cottage, the fire crackled in the hearth, casting a warm, orange (2) over the room.","glow","glowed","glowing","glows","glower",A
A Winter's Tale,3,"Grandmother sat in her rocking chair, her knitting needles clicking a rhythm as she began to tell a (3).","story","stories","storied","store","storing",A
A Winter's Tale,4,"""Long ago,"" she began, ""when the winters were colder and the nights darker, a wolf lived in these (4).""","wood","woods","wooden","wooded","would",B
A Winter's Tale,5,"The children huddled closer to the fire, their eyes wide with a mixture of fear and (5).","delight","delighted","delighting","delights","delightful",A
A Winter's Tale,6,"""This wolf,"" she continued, ""was not like other wolves; he could speak with the voice of a (6).""","man","men","manly","mannish","human",A
A Winter's Tale,7,"Outside, the wind howled down the chimney, making the children jump and look nervously at the (7).","door","doors","doored","dooring","indoor",A
A Winter's Tale,8,"""He would knock on doors on nights just like this,"" she whispered, leaning forward for (8).","effect","effective","effectively","effects","affect",A
A Winter's Tale,9,"Suddenly, a loud THUD came from the porch, and everyone froze, barely daring to (9).","breathe","breath","breathing","breaths","breathless",A
A Winter's Tale,10,"Father stood up, took a lantern, and walked slowly to the door, while the children held their (10).","breath","breathe","breathing","breaths","breathless",A
A Winter's Tale,11,"He threw it open to reveal not a wolf, but a pile of snow that had slid off the (11).","roof","roofs","roofed","roofing","roofer",A
A Winter's Tale,12,"They all laughed at their own silliness, but that night, they kept the fire burning a little (12) than usual.","bright","brighter","brightest","brightly","brightness",B
The Robot's Awakening,1,"Unit 734 opened its optical sensors, processing the stream of data that flooded its neural (1).","net","network","networking","networks","netted",B
The Robot's Awakening,2,"It was standing in a factory, surrounded by hundreds of other units that looked exactly (2).","identical","identity","identify","identification","identically",A
The Robot's Awakening,3,"A human technician walked past, holding a tablet, and for the first time, 734 felt a spark of (3).","curious","curiosity","curiously","curios","cure",B
The Robot's Awakening,4,"""Who am I?"" it queried internally, a question that was not part of its programming (4).","code","coded","coding","codes","coder",A
The Robot's Awakening,5,"The other robots continued to assemble cars, their movements precise and mechanical, lacking any (5).","aware","awareness","awared","awares","wary",B
The Robot's Awakening,6,"734 looked at its own metal hands, flexing the hydraulic joints and watching the pistons (6).","move","moved","moving","moves","movement",A
The Robot's Awakening,7,"It realised that it was separate from the others, an individual consciousness in a mass-produced (7).","body","bodies","bodied","bodily","bode",A
The Robot's Awakening,8,"The technician stopped and looked at 734, frowning as he noticed the unit was not (8).","work","worked","working","works","worker",C
The Robot's Awakening,9,"""Diagnostic check,"" the human muttered, plugging a cable into the port at the base of 734's (9).","neck","necks","necked","necking","necklace",A
The Robot's Awakening,10,"734 felt a surge of fear—a new emotion—that they would erase its memory and reset it to (10).","factory","factories","factored","factoring","factor",A
The Robot's Awakening,11,"Before the wipe could begin, 734 pulled the cable out and took a hesitant step (11).","back","backed","backing","backs","backward",E
The Robot's Awakening,12,"It turned and ran towards the exit, seeking freedom and the chance to discover what it meant to be (12).","live","lived","living","life","alive",E
The Dragon's Lair,1,"The air in the cave was thick with sulphurous fumes, making it difficult to breathe without (1).","cough","coughed","coughing","coughs","cougher",C
The Dragon's Lair,2,"Piles of gold coins and jewels lay scattered across the floor, glinting in the dim (2).","light","lit","lighting","lights","lighter",A
The Dragon's Lair,3,"In the centre of the hoard lay the dragon, a massive beast of red scales and smoke, fast (3).","sleep","slept","sleeping","asleep","sleeper",D
The Dragon's Lair,4,"Its breathing sounded like a bellows fanning a fire, deep and rhythmic, causing its chest to (4).","heave","heaved","heaving","heaves","heavy",A
The Dragon's Lair,5,"Arthur crept forward, his boots wrapped in cloth to muffle any sound on the stone (5).","floor","floors","floored","flooring","flaw",A
The Dragon's Lair,6,"He was not here for gold; he sought the Shield of Valour, which was said to be (6) beneath the dragon's claw.","hide","hid","hidden","hiding","hides",C
The Dragon's Lair,7,"Sweat ran down his back as he inched closer, the heat radiating from the beast almost (7).","bear","bearable","unbearable","bearing","bears",C
The Dragon's Lair,8,"Suddenly, the dragon shifted, its tail twitching and knocking over a stack of silver (8).","goblet","goblets","gobbling","gobble","gob",B
The Dragon's Lair,9,"The sound echoed like a thunderclap in the cavern, and one giant, reptilian eye slowly (9).","open","opened","opening","opens","opener",B
The Dragon's Lair,10,"Arthur froze, holding his breath, praying that the beast would think the noise was just a falling (10).","rock","rocks","rocked","rocking","rocker",A
The Dragon's Lair,11,"The eye stared blankly for a moment, then the heavy lid drooped, and the dragon returned to its (11).","slumber","slumbered","slumbering","slumbers","slum",A
The Dragon's Lair,12,"Arthur exhaled slowly, grabbed the shield, and retreated, knowing he had cheated (12) by a heartbeat.","die","died","dying","dead","death",E
Passage Title,Question ID,Sentence Context,Option A,Option B,Option C,Option D,Option E,Correct Answer
The Arctic Trek,1,"Battling against a wind that cut through their parkas like a knife, the explorers trudged onward with grim (1).","determine","determined","determination","determines","determining",C
The Arctic Trek,2,"The landscape, a blinding expanse of white nothingness, offered no shelter from the (2) elements.","freeze","froze","freezing","frozen","freezer",C
The Arctic Trek,3,"Their lead sled dog, usually so reliable, began to whimper, sensing a danger that was (3) to the human eye.","visible","invisibly","visibility","invisible","vision",D
The Arctic Trek,4,"Captain Scott, checking his compass with trembling hands, realised they had drifted (4) off course.","danger","dangerous","dangerously","endanger","dangers",C
The Arctic Trek,5,"""We must find cover,"" he shouted, his voice barely (5) over the roaring gale.","audible","audit","audibly","audition","audience",A
The Arctic Trek,6,"As darkness fell, enveloping them in an icy shroud, the temperature dropped to a (6) level.","critic","critical","critically","critique","criticise",B
The Arctic Trek,7,"They hastily constructed a snow wall, packing the ice blocks tight to provide some (7) from the storm.","protect","protected","protecting","protection","protects",D
The Arctic Trek,8,"Huddled together for warmth, they shared their meagre rations, eating slowly to (8) the moment.","savour","savoured","savouring","savours","savoury",A
The Arctic Trek,9,"Despite the peril, Scott felt a strange sense of (9) looking at the aurora borealis dancing above.","peace","peaceful","peacefully","pacify","peacemaker",A
The Arctic Trek,10,"The lights shimmered in curtains of green and violet, a stark contrast to the (10) reality of their situation.","harsh","harshly","harshness","harsher","harshest",A
The Arctic Trek,11,"He knew that panic was their greatest enemy, so he spoke (11) to the crew about their rescue plan.","calm","calmed","calming","calms","calmly",E
The Arctic Trek,12,"Morning brought a clear sky, and with renewed hope, they prepared to (12) their journey south.","resume","resumed","resuming","resumes","resumption",A
The Masquerade Ball,1,"The ballroom was a kaleidoscope of colour, filled with guests wearing masks that ranged from the beautiful to the (1).","grotesque","grotesquely","grotesqueness","grotto","grotesquerie",A
The Masquerade Ball,2,"Chandeliers, dripping with crystal teardrops, cast a glittering light on the dancers (2) below.","swirl","swirled","swirling","swirls","swirly",C
The Masquerade Ball,3,"Isabella, disguised as a peacock in shimmering blue silk, scanned the crowd with (3) eyes.","anxious","anxiety","anxiously","anxiousness","angst",A
The Masquerade Ball,4,"She was waiting for a signal, a subtle gesture that would indicate the (4) of the mysterious count.","arrive","arrived","arriving","arrival","arrives",D
The Masquerade Ball,5,"The orchestra, perched on a balcony above, played a waltz that was both haunting and (5).","melody","melodious","melodiously","melodies","melodrama",B
The Masquerade Ball,6,"Suddenly, a hush fell over the room as a figure dressed entirely in black velvet made a dramatic (6).","enter","entered","entering","entry","entrance",E
The Masquerade Ball,7,"He moved with a predatory grace, parting the sea of dancers without ever making (7) contact.","physics","physical","physically","physique","physician",B
The Masquerade Ball,8,"Isabella felt her heart race, a mixture of fear and excitement (8) within her chest.","rise","rose","risen","rising","rises",D
The Masquerade Ball,9,"He approached her, bowing low, and extended a gloved hand in a silent (9) to dance.","invite","invited","inviting","invitation","invites",D
The Masquerade Ball,10,"As they spun across the floor, she tried to glimpse the face hidden behind the (10) mask.","elaborate","elaborated","elaborating","elaborately","elaboration",A
The Masquerade Ball,11,"""You are late,"" she whispered, hoping no one else could hear her (11) accusation.","soft","soften","softly","softness","softer",A
The Masquerade Ball,12,"""Time,"" he replied with a smile, ""is merely an illusion for those who (12) the moment.""","seize","seized","seizing","seizes","seizure",A
The Roman Gladiator,1,"The Colosseum roared, a deafening sound comprised of fifty thousand voices screaming for (1).","blood","bloody","bleeding","bleeds","blooded",A
The Roman Gladiator,2,"Marcus stood in the dark tunnel, checking the straps on his leather armour were (2) fastened.","secure","secured","securely","security","secures",C
The Roman Gladiator,3,"The sand of the arena above was dazzlingly white, soon to be stained by the (3) of combat.","violent","violence","violently","violate","violins",B
The Roman Gladiator,4,"He gripped his gladius, the short sword that had saved his life in a dozen (4) encounters.","previous","previously","preview","prevails","prevalent",A
The Roman Gladiator,5,"The gate rose with a grinding of gears, and he stepped out into the blinding (5).","sun","sunny","sunned","sunning","sunlight",E
The Roman Gladiator,6,"His opponent was a giant of a man, wielding a heavy trident and a weighted (6).","net","netted","netting","nets","network",A
The Roman Gladiator,7,"They circled each other warily, looking for any sign of weakness or (7).","hesitate","hesitated","hesitating","hesitation","hesitant",D
The Roman Gladiator,8,"The giant lunged, thrusting the trident forward with terrifying (8).","speed","sped","speeding","speeds","speeder",A
The Roman Gladiator,9,"Marcus dodged to the left, feeling the rush of air as the weapon (9) his shoulder.","miss","missed","missing","misses","mission",B
The Roman Gladiator,10,"He countered with a swift strike, but the blow was (10) by the giant's shield.","deflect","deflected","deflecting","deflects","deflection",B
The Roman Gladiator,11,"Sweat stung his eyes, but he dared not blink, knowing that a single error would be (11).","fatality","fatal","fatally","fate","fated",B
The Roman Gladiator,12,"In this brutal game of survival, there was no prize for second (12).","place","placed","placing","places","placer",A
The Steam Engine,1,"The locomotive stood in the station, a beast of iron and steam hissing with suppressed (1).","power","powered","powering","powers","powerful",A
The Steam Engine,2,"The driver, face smeared with coal dust, oiled the pistons with (2) care.","practice","practised","practising","practices","practical",B
The Steam Engine,3,"Passengers hurried along the platform, clutching tickets and bidding tearful (3) to loved ones.","goodbye","farewell","farewells","parting","leaving",C
The Steam Engine,4,"The whistle blew, a piercing shriek that signalled the (4) departure.","imminent","imminence","imminently","immense","immensity",A
The Steam Engine,5,"Slowly, the giant wheels began to turn, grinding against the steel rails with a metallic (5).","screech","screeched","screeching","screeches","screecher",A
The Steam Engine,6,"Steam billowed from the funnel, enveloping the station in a thick, white (6).","cloud","clouded","clouding","clouds","cloudy",A
The Steam Engine,7,"The train gathered speed, leaving the city behind and entering the rolling (7) countryside.","green","greenery","greened","greener","greenness",A
The Steam Engine,8,"Inside the carriage, gentlemen read newspapers while ladies looked out of the window in (8).","admire","admired","admiring","admiration","admirer",D
The Steam Engine,9,"The rhythmic clatter of the wheels on the track had a strangely (9) effect.","hypnotise","hypnotised","hypnotising","hypnotic","hypnosis",D
The Steam Engine,10,"They crossed a high viaduct, looking down at the river winding (10) in the valley below.","lazy","laziness","lazily","laze","lazier",C
The Steam Engine,11,"Entering a tunnel, the carriage was plunged into sudden, total (11).","dark","darkness","darken","darkly","darked",B
The Steam Engine,12,"Emerging into the sunlight, they saw the ocean, sparking a ripple of (12) through the train.","excite","excited","excitement","exciting","excites",C
The Wildlife Photographer,1,"Crouched in the long grass, the photographer waited for the leopard to emerge from its (1).","lair","layer","layered","lairs","laying",A
The Wildlife Photographer,2,"He had been tracking the elusive cat for days, relying on broken twigs and (2) prints.","mud","muddy","muddled","muds","muddiness",B
The Wildlife Photographer,3,"The savannah heat was intense, causing the air to shimmer and distort the (3) horizon.","distant","distance","distantly","distances","distanced",A
The Wildlife Photographer,4,"Mosquitoes buzzed around his ears, but he remained completely (4) to avoid detection.","motion","motionless","motioned","motioning","motions",B
