Passage Title,Question ID,Sentence Context,Option A,Option B,Option C,Option D,Option E,Correct Answer
The Antique Shop,1,"Stepping into the dimly lit shop, which smelled faintly of beeswax and old paper, Sarah felt a sudden shiver of (1) run down her spine.","anticipate","anticipation","anticipated","anticipating","anticipates",B
The Antique Shop,2," shelves, groaning under the weight of porcelain figures and brass instruments, seemed to (2) in toward her as she moved deeper into the room.","lean","leaned","leaning","leans","leaner",A
The Antique Shop,3,"Mr. Abernathy, the proprietor, peered over his spectacles, his eyes twinkling with a (3) that made Sarah feel both welcome and slightly uneasy.","know","knew","knowing","knowledge","knowingly",D
The Antique Shop,4,"""I have been expecting you,"" he whispered, his voice sounding like dry leaves (4) across a pavement.","scrape","scraped","scraping","scrapes","scraper",C
The Antique Shop,5,"Sarah, who had only stumbled upon the shop by accident, looked at him in (5) confusion.","utter","utterly","uttered","uttering","utterance",A
The Antique Shop,6,"""There is a particular item,"" he continued, moving towards a glass cabinet, ""that has been (6) for your arrival for many years.""","wait","waited","waiting","waits","waiter",C
The Antique Shop,7,"Inside the cabinet lay a silver locket, tarnished with age yet engagingly (7) to Sarah's eye.","beauty","beautiful","beautifully","beautify","beauties",B
The Antique Shop,8,"She felt an inexplicable (8) to reach out and touch the cold metal.","urge","urged","urging","urgent","urgency",A
The Antique Shop,9,"""Be careful,"" warned Mr. Abernathy, ""for objects such as this often carry a heavy (9).""","burden","burdened","burdening","burdens","burdensome",A
The Antique Shop,10,"Ignoring his warning, she grasped the locket, and immediately a flood of memories that were not her own (10) her mind.","invade","invaded","invading","invades","invader",B
The Antique Shop,11,"She saw a ballroom filled with dancers, heard music playing (11) in the distance, and felt a heart breaking in sorrow.","soft","soften","softly","softness","softer",C
The Antique Shop,12,"Gasping for breath, she dropped the locket, realising that some secrets are best left (12).","disturb","disturbed","undisturbed","disturbing","disturbance",C
Storm at Sea,1,"The Captain, gripping the wheel with white-knuckled hands, watched as the colossal wave (1) above the bow of the ship.","rise","rose","risen","rising","rises",B
Storm at Sea,2,"The wind, screaming through the rigging like a banshee, threatened to (2) the canvas sails into shreds at any moment.","tear","tore","torn","tearing","tears",A
Storm at Sea,3,"Below deck, the crew huddled together, their faces pale with (3) as the hull groaned under the immense pressure of the ocean.","anxious","anxiety","anxiously","anxiousness","angst",B
Storm at Sea,4,"""Hold fast!"" bellowed the First Mate, his voice barely (4) over the roar of the tempest.","audible","audit","audibly","audition","audience",A
Storm at Sea,5,"Water crashed onto the deck, sweeping away loose barrels and leaving a trail of (5) in its wake.","destruct","destroyed","destroying","destruction","destructive",D
Storm at Sea,6,"The ship listed heavily to the port side, causing everything not bolted down to (6) across the cabin floor.","slide","slid","sliding","slides","slider",A
Storm at Sea,7,"For a terrifying moment, it seemed as though the vessel would never (7) itself against the relentless assault of the waves.","right","righted","righting","rights","rightly",A
Storm at Sea,8,"Captain Haddock, however, was a man of great (8) and refused to yield to the fury of nature.","determined","determination","determine","determining","determines",B
Storm at Sea,9,"He steered the ship directly into the trough of the wave, praying that the timber would (9) the impact.","withstand","withstood","withstanding","withstands","withstandingly",A
Storm at Sea,10,"With a sickening crunch, the ship shuddered violently, but miraculously, it (10) afloat.","remain","remained","remaining","remains","remainder",B
Storm at Sea,11,"Gradually, the winds began to subside, and the mountainous seas (11) to a manageable swell.","less","lessen","lessened","lessening","lesson",C
Storm at Sea,12,"Exhausted but alive, the crew emerged on deck to see the sun breaking (12) through the dissipating storm clouds.","glory","glorious","gloriously","glories","glorified",C
The Hidden Valley,1,"After hacking through the dense undergrowth for three days, the explorers finally stumbled upon a valley that time seemed to have (1).","forget","forgot","forgotten","forgetting","forgets",C
Storm at Sea,12,"Exhausted but alive, the crew emerged on deck to see the sun breaking (12) through the dissipating storm clouds.","glory","glorious","gloriously","glories","glorified",C
The Hidden Valley,1,"After hacking through the dense undergrowth for three days, the explorers finally stumbled upon a valley that time seemed to have (1).","forget","forgot","forgotten","forgetting","forgets",C
The Hidden Valley,2,"Towering cliffs, sheered off as if by a giant knife, (2) the lush basin from the outside world.","protect","protected","protecting","protects","protection",B
The Hidden Valley,3,"A waterfall, cascading from the heights above, fed a crystal-clear lake that (3) like a sapphire in the sunlight.","spark","sparkle","sparkled","sparkling","sparkles",C
The Hidden Valley,4,"Dr. Evans, wiping the sweat from his brow, gazed in (4) at the flora that surrounded them.","amaze","amazed","amazing","amazement","amazes",D
The Hidden Valley,5,"""These species,"" he whispered, ""were thought to be (5) millions of years ago.""","extinct","extinction","extinguish","exit","exist",A
The Hidden Valley,6,"Giant ferns unfurled their fronds, and flowers the size of dinner plates emitted a (6) scent that hung heavy in the air.","head","heady","heading","headed","header",B
The Hidden Valley,7,"Suddenly, a screech echoed through the valley, a sound so primal it caused the team to freeze in (7).","terror","terrible","terrify","terrified","terrifies",A
The Hidden Valley,8,"Above them, a creature with a wingspan of ten feet glided (8) on the thermal currents.","effort","effortless","effortlessly","efforts","effect",C
The Hidden Valley,9,"It was a pterodactyl, a relic of the prehistoric age, hunting for its next (9).","meal","mealed","mealing","meals","mealy",A
The Hidden Valley,10,"The explorers realised they were not merely observers, but potentially (10) in a land of predators.","prey","prayed","prayer","preying","predator",A
The Hidden Valley,11,"They needed to find shelter immediately, before the sun set and the true (11) of the valley emerged.","danger","dangerous","dangerously","endanger","dangers",E
The Hidden Valley,12,"Retreating to a small cave, they set up camp, their excitement tempered by a growing sense of (12).","uneasy","unease","easily","ease","easier",B
A Midnight Heist,1,"The thief, dressed entirely in black, waited in the shadows until the guard had (1) the corner of the building.","turn","turned","turning","turns","turner",B
A Midnight Heist,2,"With the agility of a cat, he scaled the high wall, avoiding the razor wire that (2) the perimeter.","line","lined","lining","lines","liner",B
A Midnight Heist,3,"He dropped silently onto the grass, pausing only to check that his presence had gone (3).","detect","detected","detecting","undetected","detective",D
A Midnight Heist,4,"The museum windows were alarmed, but he had purchased a device designed to (4) the electronic signal.","block","blocked","blocking","blocks","blockage",A
A Midnight Heist,5,"Attaching the suction cup to the glass, he cut a perfect circle and removed the pane with (5) precision.","surgical","surgeon","surgery","surgically","surge",A
A Midnight Heist,6,"Inside, the air was cool and smelled of polish; statues loomed in the darkness like (6) sentinels.","ghost","ghostly","ghosting","ghosts","ghosted",B
A Midnight Heist,7,"His target was the Star of India, a diamond rumoured to be (7) millions on the black market.","worth","worthy","worthiness","worthless","worthwhile",A
A Midnight Heist,8,"Approaching the display case, he noticed a grid of laser beams, invisible to the naked eye but (8) with his special glasses.","reveal","revealed","revealing","reveals","revelation",B
A Midnight Heist,9,"He contorted his body, twisting and turning to avoid the deadly beams that would (9) the sirens.","trigger","triggered","triggering","triggers","trick",A
A Midnight Heist,10,"Sweat trickled down his forehead, stinging his eyes, but he dared not (10) his focus for a second.","lose","lost","losing","loses","loser",A
A Midnight Heist,11,"Finally reaching the pedestal, he swapped the diamond for a replica of (11) weight and size.","identify","identical","identically","identity","identification",B
A Midnight Heist,12,"As he slipped back into the night, he smiled, knowing he had just committed the perfect (12).","crime","criminal","criminally","criminology","crimp",A
The Victorian Factory,1,"The factory whistle blew, a shrill, piercing sound that summoned the workers from their (1) slumber.","fit","fitful","fitfully","fitness","fitting",B
The Victorian Factory,2,"Thick, black smoke billowed from the chimney stacks, choking the air and coating the city in a layer of (2) grime.","industry","industrial","industrious","industriously","indus",B
The Victorian Factory,3,"Inside, the noise was deafening; the clanking of metal and the hiss of steam made conversation (3).","possible","impossible","possibility","possibly","impossibility",B
The Victorian Factory,4,"Small children, their faces smeared with soot, scrambled under the spinning looms to retrieve (4) threads.","break","broke","broken","breaking","breaks",C
The Victorian Factory,5,"They risked injury every time they reached into the machinery, but the overseer permitted no (5).","lazy","laziness","lazily","laze","lazier",B
The Victorian Factory,6,"Mr. Gradgrind, the owner, walked the floor with a cane, his eyes scanning for any sign of (6).","idle","idleness","idly","idling","idol",B
The Victorian Factory,7,"He believed that work was a virtue and that rest was merely a (7) of time and money.","waste","wasted","wasting","wastes","wastage",A
The Victorian Factory,8,"Young Thomas, coughing continuously, struggled to keep up with the (8) pace of the conveyor belt.","relent","relentless","relentlessly","relenting","relents",B
The Victorian Factory,9,"His hands were raw and blistered, yet he knew that losing this job would mean (9) for his family.","starve","starved","starving","starvation","starver",D
The Victorian Factory,10,"At midday, the machines stopped for a brief thirty minutes, allowing the workers to eat their (10) lunch of stale bread.","meagre","meagerly","meagreness","meager","merge",A
The Victorian Factory,11,"Despite the hardship, there was a sense of camaraderie among the workers, a shared bond of (11).","suffer","suffered","suffering","suffers","sufferer",C
The Victorian Factory,12,"They looked forward to Sunday, the one day when the wheels stopped turning and the air was (12) clear.","relative","relatively","relation","relate","relating",B
Space Station Alpha,1,"Floating weightlessly in the observation module, Commander Lewis looked down at the blue marble of Earth (1) below.","rotate","rotated","rotating","rotates","rotation",C
Space Station Alpha,2,"The silence of space was absolute, broken only by the rhythmic hum of the life-support systems (2) air through the station.","cycle","cycled","cycling","cycles","cyclist",C
Space Station Alpha,3,"Suddenly, a red warning light began to flash on the console, accompanied by a piercing alarm that (3) the calm.","shatter","shattered","shattering","shatters","shatterproof",B
Space Station Alpha,4,"""Hull breach in Sector 4,"" the computer voice announced (4), devoid of any human emotion.","calm","calmed","calming","calms","calmly",E
Space Station Alpha,5,"Lewis propelled himself through the connecting tunnels, grabbing handholds to (5) his momentum.","maintain","maintained","maintaining","maintains","maintenance",A
Space Station Alpha,6,"He found his colleague, Sarah, already at the airlock, struggling to seal the door against the (6) vacuum.","encroach","encroached","encroaching","encroaches","encroachment",C
Space Station Alpha,7,"""The seal has failed!"" she shouted, her voice tight with (7) as the air hissed escaping into the void.","panic","panicked","panicking","panics","panicky",A
Space Station Alpha,8,"Together, they hauled on the manual override lever, their muscles straining against the (8) pressure.","resist","resisted","resisting","resistance","resistant",D
Space Station Alpha,9,"With a final, metallic clang, the door locked into place, and the hissing sound abruptly (9).","cease","ceased","ceasing","ceases","cessation",B
Space Station Alpha,10,"They floated there for a moment, catching their breath, realising how close they had come to (10).","disaster","disastrous","disastrously","disasters","disasterous",A
Space Station Alpha,11,"""That was too close,"" whispered Sarah, wiping a bead of sweat that was (11) near her eye.","drift","drifted","drifting","drifts","drifter",C
Space Station Alpha,12,"They knew that in the unforgiving environment of space, there is no margin for (12).","error","err","erred","erring","erroneous",A
The Archaeological Dig,1,"The desert sun beat down mercilessly on the dig site, baking the ground until it was as hard as (1).","iron","ironing","ironed","irons","irony",A
The Archaeological Dig,2,"Professor Blackwood, wiping the grit from his face, gently brushed away the sand to reveal a (2) of ancient pottery.","fragment","fragmented","fragmenting","fragments","fragmentary",A
The Archaeological Dig,3,"For months they had been searching for the lost tomb of the Pharaoh, battling heat, scorpions, and (3) exhaustion.","relent","relentless","relentlessly","relenting","relents",B
The Archaeological Dig,4,"Today, however, the discovery of a stone seal bearing the royal cartouche suggested their efforts were finally (4) fruit.","bear","bearing","born","borne","bears",B
The Archaeological Dig,5,"""Bring the lantern,"" he commanded, his voice trembling slightly with suppressed (5).","excite","excited","exciting","excitement","excites",D
The Archaeological Dig,6,"As the light illuminated the dark recess, the glint of gold caught their eyes, promising treasures beyond (6).","imagine","imagined","imagining","imagination","image",D
The Archaeological Dig,7,"Inside the chamber, hieroglyphics covered the walls, telling the story of a king who had ruled with (7) power.","absolute","absolutely","absolution","absolved","absolve",A
The Archaeological Dig,8,"Statues of gods stood guard in the corners, their stone eyes staring (8) at the intruders who dared to enter.","accuse","accused","accusing","accusingly","accusation",D
The Archaeological Dig,9,"The air in the tomb was stale and dry, unchanged for thousands of years, preserving the secrets (9) within.","hold","held","holding","holds","holder",B
The Archaeological Dig,10,"Blackwood knew that this discovery would rewrite history books and cement his reputation as a (10) archaeologist.","lead","led","leading","leads","leader",C
The Archaeological Dig,11,"However, he also remembered the legends of the curse, which warned of terrible consequences for those who (11) the dead.","disturb","disturbed","disturbing","disturbs","disturbance",B
The Archaeological Dig,12,"Dismissing the thought as superstition, he stepped forward to claim his (12).","prize","prized","prizing","prizes","priser",A
The Haunted Manor,1,"The iron gates of Blackwood Manor groaned in protest as they were pushed open, revealing a driveway choked with (1) weeds.","overgrow","overgrew","overgrown","overgrowing","growth",C
The Haunted Manor,2,"Lightning flashed overhead, illuminating the broken windows that looked like empty, soulless (2) staring into the night.","eye","eyes","eyed","eyeing","sight",B
The Haunted Manor,3,"James tightened his coat around him, regretting the bet that had brought him to this (3) place at midnight.","forsake","forsook","forsaken","forsaking","sake",C
The Haunted Manor,4,"The front door was ajar, swinging slightly in the wind, as if inviting him to enter the (4) darkness within.","gloom","gloomy","gloomily","glooms","gloominess",A
The Haunted Manor,5,"He stepped into the hall, where dust motes danced in the beam of his torch, and the floorboards creaked (5) underfoot.","ominous","ominously","omen","omens","omened",B
The Haunted Manor,6,"A portrait above the fireplace depicted a stern man whose eyes seemed to (6) James as he moved across the room.","follow","followed","following","follows","follower",A
The Haunted Manor,7,"Suddenly, a cold draught extinguished his torch, plunging him into a blackness so complete it felt (7).","solid","solidly","solidify","solidity","solids",A
The Haunted Manor,8,"From the floor above, came the distinct sound of footsteps, slow and deliberate, pacing back and (8).","fourth","forth","four","fours","fore",B
The Haunted Manor,9,"James's heart hammered against his ribs like a trapped bird, his breath coming in shallow, (9) gasps.","ragged","rag","ragging","rags","raggedly",A
The Haunted Manor,10,"He scrambled for the door, fumbling with the handle which seemed to have (10) stuck fast.","become","became","becoming","becomes","comer",A
The Haunted Manor,11,"As the footsteps reached the top of the stairs, a whisper echoed through the hall: ""You should not have (11).""","come","came","coming","comes","comer",A
The Haunted Manor,12,"With a final surge of adrenaline, James kicked the door open and sprinted into the night, vowing never to (12).","return","returned","returning","returns","returner",A
Mountain Rescue,1,"The blizzard had descended with terrifying speed, transforming the mountain into a white, swirling (1) of confusion.","chaos","chaotic","chaotically","chasm","chased",A
Mountain Rescue,2,"Ben, the lead rescuer, squinted through his goggles, searching for any sign of the (2) climbers.","strand","stranded","stranding","strands","strander",B
Mountain Rescue,3,"The radio crackled with static, the only connection to the base camp where anxious families (3) for news.","wait","waited","waiting","waits","waiter",B
Mountain Rescue,4,"""We have to turn back,"" shouted his partner, ""the visibility is zero and the temperature is (4).""","drop","dropped","dropping","drops","dropper",C
Mountain Rescue,5,"""Not yet,"" Ben replied, his voice determined, ""I saw a flare (5) from that ridge ten minutes ago.""","fire","fired","firing","fires","fiery",B
Mountain Rescue,6,"Fighting against the wind that threatened to blow them off the ledge, they inched their way (6).","forward","forwards","fore","before","foward",A
Mountain Rescue,7,"Suddenly, Ben spotted a patch of bright red jacket amidst the snow, half-buried and (7).","motion","motionless","motioned","motioning","motions",B
Mountain Rescue,8,"They dug frantically, pulling the climber from the drift and wrapping him in a thermal (8) to restore body heat.","blanket","blanketed","blanketing","blankets","blank",A
Mountain Rescue,9,"The man was barely conscious, his lips blue with cold, but he managed to whisper a faint ""thank you"" to his (9).","rescue","rescued","rescuing","rescues","rescuers",E
Mountain Rescue,10,"The descent was treacherous, requiring them to lower the injured man down steep ice walls using ropes and (10).","pulley","pulleys","pulled","pulling","pull",B
Mountain Rescue,11,"Every step was a battle against fatigue and the elements, but the thought of saving a life kept them (11).","go","went","going","gone","goes",C
Mountain Rescue,12,"When the lights of the rescue helicopter finally pierced the darkness, Ben felt a wave of relief wash (12) him.","over","above","on","in","at",A
The Grand Banquet,1,"The Great Hall was decorated with tapestries of gold and crimson, preparing for the arrival of the King and his (1).","entourage","tour","tourist","touring","toured",A
The Grand Banquet,2,"Servants scurried back and forth carrying silver platters piled high with roasted meats, exotic fruits, and fresh (2).","bake","baked","baking","baker","bakery",B
The Grand Banquet,3,"The aroma of spices, imported from distant lands at great expense, (3) the air, making everyone's mouth water.","fill","filled","filling","fills","filler",B
The Grand Banquet,4,"Musicians played lutes and harps in the gallery, their sweet melodies providing a pleasant backdrop to the (4) chatter.","live","lived","lively","life","living",C
The Grand Banquet,5,"When the King entered, a hush fell over the room, and the guests bowed low in a show of deep (5).","respect","respected","respecting","respects","respectful",A
The Grand Banquet,6,"He took his seat at the head of the table, signalling for the feast to (6).","begin","began","beginning","begins","beginner",A
The Grand Banquet,7,"However, beneath the surface of celebration, there was an undercurrent of tension and political (7).","intrigue","intrigued","intriguing","intrigues","intriguer",A
The Grand Banquet,8,"The Duke of York, seated to the King's left, whispered (8) to his neighbour, casting furtive glances at the monarch.","urgent","urgency","urgently","urge","urged",C
The Grand Banquet,9,"It was rumoured that a plot was afoot to seize the throne, and every wine goblet was checked for (9).","poison","poisoned","poisoning","poisons","poisonous",A
The Grand Banquet,10,"The King, aware of the treachery, ate only from his own plate and watched his courtiers with (10) eyes.","narrow","narrowed","narrowing","narrows","narrowly",B
The Grand Banquet,11,"Despite the danger, he laughed loudly and drank deeply, refusing to show any sign of (11) or weakness.","fear","feared","fearing","fears","fearful",A
The Grand Banquet,12,"For in the dangerous game of power, appearance was everything, and a King must always appear (12).","invincible","invisible","invisibility","invincibility","vision",A
The Inventor's Workshop,1,"The workshop was a chaotic jumble of cogs, springs, and brass pipes, illuminated by the flickering light of a gas (1).","lamp","lamps","lamping","lamplight","lamppost",A
The Inventor's Workshop,2,"Old Mr. Cogsworth sat at his workbench, adjusting a tiny screw with a pair of tweezers and a magnifying (2).","glass","glasses","glassy","glaze","glazer",A
The Inventor's Workshop,3,"Steam hissed from a valve in the corner, filling the room with a warm, damp fog that smelled of oil and (3).","metal","metallic","metalwork","metals","metallurgy",A
The Inventor's Workshop,4,"He was working on his masterpiece, a mechanical bird that would be able to sing and fly just like a (4) one.","real","reality","really","realism","realist",A
The Inventor's Workshop,5,"""Just one more adjustment,"" he muttered, his hands trembling slightly with (5) and age.","excite","excited","excitement","exciting","excites",C
The Inventor's Workshop,6,"He carefully wound the key in the bird's back, listening for the satisfying click of the mainspring (6).","engage","engaged","engaging","engages","engagement",C
The Inventor's Workshop,7,"Placing the bird on the table, he stepped back and held his breath, waiting for a sign of (7).","live","lived","living","life","lively",D
The Inventor's Workshop,8,"Slowly, the metal wings began to flutter, and a beak of polished gold opened to emit a (8) melody.","sweet","sweetly","sweeten","sweetness","sweets",A
The Inventor's Workshop,9,"It hovered in the air, circling the room with a grace that defied its mechanical (9).","origin","original","originally","origins","originate",A
The Inventor's Workshop,10,"Tears of joy streamed down Mr. Cogsworth's face as he watched his creation come to (10).","live","lived","living","life","lively",D
The Inventor's Workshop,11,"He had spent his entire life trying to replicate nature, and finally, he had (11).","succeed","succeeded","success","successful","succession",B
The Inventor's Workshop,12,"The bird landed gently on his shoulder, chirping softly, a perfect blend of science and (12).","magic","magical","magically","magician","mage",A
Jungle Expedition,1,"The humidity in the jungle was stifling, wrapping around the explorers like a heavy, wet (1).","blanket","blanketed","blanketing","blankets","blank",A
Jungle Expedition,2,"Insects the size of fists buzzed around their heads, and the air was thick with the scent of rotting (2).","vegetable","vegetation","vegetarian","vegetate","vegetative",B
Jungle Expedition,3,"Captain Sterling hacked at the vines with his machete, clearing a path through the green (3) that blocked their way.","wall","walls","walled","walling","wallet",A
Jungle Expedition,4,"""We must be getting close,"" he panted, pointing to a stone carving half-buried in the (4).","mud","muddy","muddled","muds","muddiness",A
Jungle Expedition,5,"The carving depicted a jaguar warrior, a guardian of the lost temple they had travelled thousands of miles to (5).","find","found","finding","finds","finder",A
Jungle Expedition,6,"Suddenly, the ground beneath them gave way, and they slid down a muddy slope into a hidden (6).","clear","clearing","cleared","clears","clearly",B
Jungle Expedition,7,"Before them stood the temple, covered in moss but still magnificent, its stone steps rising towards the (7).","canopy","canopied","canopies","can","canoping",A
Jungle Expedition,8,"""It's real,"" whispered the youngest member of the team, staring in (8) at the ancient structure.","believe","belief","disbelief","believed","believing",C
Jungle Expedition,9,"However, the silence of the jungle was suddenly broken by a low growl emerging from the darkness of the temple (9).","enter","entrance","entry","entered","entering",B
